{
  "model_manifest_id": "fake/audio/runtime-foundation-manifest/v1",
  "provider_id": "audio",
  "model_id": "fake/audio/runtime-foundation",
  "model_version": "1.0-test",
  "checkpoint_version": "NOT_APPLICABLE",
  "model_type": "contract_fixture",
  "capabilities": [
    "music_generation",
    "stem_separation",
    "audio_analysis"
  ],
  "input_formats": [
    "application/json",
    "audio/wav"
  ],
  "output_formats": [
    "application/json",
    "audio/wav"
  ],
  "api_contract_version": "1.0",
  "dataset_manifest_id": null,
  "training_run_id": null,
  "evaluation_result_id": null,
  "license_status": "NOT_APPLICABLE",
  "commercial_usage_status": "NOT_APPLICABLE",
  "recommended_vram": null,
  "runtime_environment": {
    "implementation": "deterministic_fake",
    "ai_model": "none"
  },
  "artifact_checksum": "sha256:94119561ba871529d1dbe4d07d74644e5c4a2495529088fe31dae960e119eddc",
  "created_at": "2026-08-19T00:00:00Z"
}
